{
  "$schema" : "http://json-schema.org/draft-07/schema#",
  "type" : "array",
  "items" : {
    "type" : "object",
    "properties" : {
      "completed" : {
        "type" : "boolean"
      },
      "dueDate" : {
        "type" : "string"
      },
      "id" : {
        "type" : "integer"
      },
      "title" : {
        "type" : "string"
      }
    }
  }
}